id,jobtitle,department,location,createdat,summary,qualification,description,addtionalrequrement,paybenefit,questionnaireid
1,Software Engineer,UJU Technology,United States,01/10/2023,"As a Software Engineer at Uju, you'll contribute to cutting-edge projects in software development, collaborating with a dynamic team to create innovative solutions for our tech-driven initiatives.",- Bachelor's degree in Computer Science or equivalent.,"Join our technology team to design, develop, test, and deploy software solutions. Work on projects ranging from software applications to system integrations, applying your expertise in programming languages such as Python, Java, or C++.",• Strong problem-solving skills,"Base pay range: $80,000 - $120,000","1, 2, 3, 4, 5, 6, 7, 8, 9, 10, 11, 12, 13, 14"
2,UX/UI Designer,UJU Design,United States,01/20/2023,Shape the user experience and visual identity of Uju's products as a UX/UI Designer. Collaborate with cross-functional teams to create compelling designs that enhance user satisfaction and engagement.,- Bachelor's degree in Design or related field.,"Bring creativity to life by crafting user-centric designs, wireframes, and prototypes. Work closely with development teams to implement intuitive and visually appealing interfaces.",• Portfolio showcasing design projects,"Base pay range: $85,000 - $130,000","1, 2, 3, 4, 5, 6, 7, 8, 9, 10, 20, 21, 22"
3,Marketing Specialist,UJU Marketing,United States,02/01/2023,"Join the Uju Marketing team to drive brand awareness and engagement. Execute marketing campaigns, analyze data, and collaborate with internal and external partners to achieve marketing goals.",- Bachelor's degree in Marketing or related field.,Develop and implement marketing strategies across various channels. Analyze market trends and customer behavior to optimize campaigns.,• Experience with digital marketing tools,"Base pay range: $70,000 - $110,000","1, 2, 3, 4, 5, 6, 7, 8, 9, 10, 18, 19"
4,Sales Representative,UJU Sales,United States,02/10/2023,"Join our technology team as a Network Engineer, responsible for designing and maintaining Uju's network infrastructure. Collaborate with IT teams to ensure seamless connectivity and security.",- Bachelor's degree in Network Engineering or equivalent.,"Design, implement, and manage Uju's network infrastructure. Troubleshoot network issues and implement security measures.",• Knowledge of network protocols and security,"Base pay range: $90,000 - $140,000","1, 2, 3, 4, 5, 6, 7, 8, 9, 10, 23, 24, 25"
5,Network Engineer,UJU Technology,United States,02/20/2023,"Provide exceptional customer service and support in our retail environment. Assist customers with product inquiries, transactions, and create a positive shopping experience.",- High school diploma or equivalent.,"Greet and assist customers, process transactions, and maintain product knowledge. Keep the retail space organized and contribute to a positive team environment.",• Availability to work weekends and holidays,"Base pay range: $30,000 - $40,000","1, 2, 3, 4, 5, 6, 7, 8, 9, 10, 11, 12, 13, 14"
6,Retail Associate,UJU Retail,United States,03/01/2023,"As a Data Scientist, leverage your analytical skills to extract insights from data and drive informed decision-making. Collaborate with cross-functional teams to implement data-driven solutions.",- Master's degree in Data Science or related field.,"Analyze large datasets, develop statistical models, and communicate findings to non-technical stakeholders.",• Proficiency in programming languages like Python or R,"Base pay range: $100,000 - $150,000","1, 2, 3, 4, 5, 6, 7, 8, 9, 10, 26, 27"
7,Data Scientist,UJU Technology,United States,03/10/2023,"Join the Corporate Support team as an HR Specialist, responsible for recruitment, employee relations, and HR operations.",- Bachelor's degree in Human Resources or related field.,"Manage the end-to-end recruitment process, handle employee relations, and support HR operations.",• Knowledge of labor laws and HR best practices,"Base pay range: $80,000 - $120,000","1, 2, 3, 4, 5, 6, 7, 8, 9, 10, 11, 12, 13, 14"
8,HR Specialist,UJU Corporate Support,United States,03/15/2023,Collaborate with business units to analyze and optimize systems and processes. Design and implement efficient solutions to enhance Uju's overall operational efficiency.,- Bachelor's degree in Information Systems or equivalent.,"Assess business needs, analyze system requirements, and develop solutions to improve efficiency.",• Strong problem-solving and analytical skills,"Base pay range: $85,000 - $130,000","1, 2, 3, 4, 5, 6, 7, 8, 9, 10, 15, 16, 17"
9,Systems Analyst,UJU Technology,United States,04/01/2023,Craft compelling and engaging content for various marketing channels. Collaborate with marketing teams to develop content strategies that resonate with the target audience.,"- Bachelor's degree in English, Marketing, or related field.","Create content for websites, blogs, social media, and other marketing platforms. Ensure content aligns with brand messaging and marketing objectives.",• Excellent writing and editing skills,"Base pay range: $60,000 - $100,000","1, 2, 3, 4, 5, 6, 7, 8, 9, 10, 11, 12, 13, 14"
10,Content Writer,UJU Marketing,United States,04/10/2023,"Provide technical support to Uju employees, troubleshoot hardware and software issues, and contribute to maintaining a secure IT environment.",- Associate degree in IT or related field.,"Respond to IT support tickets, troubleshoot hardware and software issues, and provide technical assistance to employees.","• Certifications in IT support (e.g., CompTIA A+)","Base pay range: $50,000 - $80,000","1, 2, 3, 4, 5, 6, 7, 8, 9, 10, 18, 19"
11,IT Support Specialist,UJU Technology,United States,04/10/2023,"Provide technical support to Uju employees, troubleshoot hardware and software issues, and contribute to maintaining a secure IT environment.",- Associate degree in IT or related field.,"Respond to IT support tickets, troubleshoot hardware and software issues, and provide technical assistance to employees.","• Certifications in IT support (e.g., CompTIA A+)","Base pay range: $50,000 - $80,000","1, 2, 3, 4, 5, 6, 7, 8, 9, 10, 11, 12, 13, 14"
12,Financial Analyst,UJU Corporate Support,United States,04/15/2023,"Join the Finance team as a Financial Analyst, responsible for financial planning, analysis, and reporting. Collaborate with departments to support strategic decision-making.","- Bachelor's degree in Finance, Accounting, or related field.","Analyze financial data, prepare reports, and provide insights to support strategic planning.",• Proficiency in financial modeling and analysis tools,"Base pay range: $75,000 - $115,000","1, 2, 3, 4, 5, 6, 7, 8, 9, 10, 15, 16, 17"
13,Space Systems Engineer,UJU Technology,United States,05/01/2023,"Contribute to Uju's space exploration projects as a Space Systems Engineer. Design and optimize systems for space missions, working on the forefront of space technology.",- Master's degree in Aerospace Engineering or equivalent.,"Design and analyze space systems, collaborate with cross-functional teams, and contribute to the success of space missions.",• Experience with space mission design and analysis,"Base pay range: $110,000 - $160,000","1, 2, 3, 4, 5, 6, 7, 8, 9, 10, 11, 12, 13, 14"
14,Legal Counsel,UJU Corporate Support,United States,05/10/2023,"Join the Legal team as Legal Counsel, providing legal guidance and support to Uju's business operations. Draft and review contracts, advise on legal matters, and ensure compliance.",- Juris Doctor (JD) degree and Bar admission.,"Draft, review, and negotiate contracts. Provide legal advice on various matters, ensuring compliance with laws and regulations.",• Knowledge of corporate and contract law,"Base pay range: $90,000 - $140,000","1, 2, 3, 4, 5, 6, 7, 8, 9, 10, 15, 16, 17"
15,Cybersecurity Analyst,UJU Technology,United States,05/15/2023,Enhance Uju's cybersecurity posture by identifying and mitigating security threats. Monitor and analyze security incidents to protect Uju's digital assets.,- Bachelor's degree in Cybersecurity or related field.,"Conduct security assessments, implement security measures, and respond to cybersecurity incidents.","• Certifications in cybersecurity (e.g., CISSP, CISM)","Base pay range: $95,000 - $145,000","1, 2, 3, 4, 5, 6, 7, 8, 9, 10, 11, 12, 13, 14"
16,Product Manager,UJU Technology,United States,06/01/2023,Lead the development and launch of innovative products at Uju. Collaborate with cross-functional teams to define product roadmaps and strategies.,- Bachelor's degree in Business or related field.,"Define product vision, develop roadmaps, and collaborate with teams to bring products to market.",• Proven experience in product management,"Base pay range: $100,000 - $150,000","1, 2, 3, 4, 5, 6, 7, 8, 9, 10, 11, 12, 13, 14"
17,Environmental Scientist,UJU Technology,United States,06/10/2023,"Contribute to Uju's environmental initiatives as an Environmental Scientist. Conduct research, analyze data, and implement strategies to support sustainable practices.",- Master's degree in Environmental Science or related field.,"Conduct environmental assessments, analyze data, and develop strategies to support Uju's sustainability goals.",• Knowledge of environmental regulations,"Base pay range: $80,000 - $120,000","1, 2, 3, 4, 5, 6, 7, 8, 9, 10, 11, 12, 13, 14"
18,Customer Support Rep,UJU Corporate Support,United States,06/15/2023,"Provide excellent customer support to Uju's clients, addressing inquiries, resolving issues, and ensuring a positive customer experience.",- High school diploma or equivalent.,"Respond to customer inquiries, troubleshoot issues, and provide timely and effective customer support.",• Strong communication and problem-solving skills,"Base pay range: $40,000 - $60,000","1, 2, 3, 4, 5, 6, 7, 8, 9, 10, 15, 16, 17"
19,Robotics Engineer,UJU Technology,United States,07/01/2023,Join our robotics team to design and develop advanced robotic systems. Collaborate with engineers to bring cutting-edge robotics technology to life.,- Master's degree in Robotics or related field.,"Design and develop robotic systems, collaborate with cross-functional teams, and contribute to advancements in robotics technology.",• Experience in robotics research and development,"Base pay range: $110,000 - $160,000","1, 2, 3, 4, 5, 6, 7, 8, 9, 10, 11, 12, 13, 14"
20,DevOps Engineer,UJU Technology,United States,08/08/2023,Join our technology team as a DevOps Engineer to architect and implement advanced DevOps solutions. Work closely with cross-functional teams to bring state-of-the-art DevOps practices to fruition.,"- Master's degree in Computer Science, Information Technology, or related field.","Architect and implement DevOps solutions, collaborate with diverse teams, and play a key role in advancing our technology infrastructure.",• Proven experience in DevOps and system administration,"Base pay range: $120,000 - $170,000","1, 2, 3, 4, 5, 6, 7, 8, 9, 10, 11, 12, 13, 14"